{"args":["claim:factory:MOS-EVIDENCE-KINDS"],"basis":"derived","depth":1,"derivations":[{"bindings":{"X":"claim:factory:MOS-EVIDENCE-KINDS"},"conclusion":["current","claim:factory:MOS-EVIDENCE-KINDS"],"depth":1,"id":"sha256:eb1268c6be05c0f908a8092a8b3c678b290cb18f971667c0b41d9bad1c2fdbdd","premises":[["node","claim:factory:MOS-EVIDENCE-KINDS","CLAIM"],{"absent":["superseded","claim:factory:MOS-EVIDENCE-KINDS"]},{"absent":["retracted","claim:factory:MOS-EVIDENCE-KINDS"]}],"rule":"g0rule-279caadc7dec1b030ba3657bfa7845504b84da8d387786e670804320d433eef9#current"}],"evaluator":"graphonomous.g0.eval.v0","inputs":["root-48ac3e32dfc56cd1450e43b92c7a38d83d71a95113da8b243951dfa305fd2213"],"key":"sha256:9a94fdea44d05d7603a065ead0644ea942438d616489342b560511af3123c07f","rel":"current","snapshot":"snapshot:g0:multi-ba4e625-d217ee2","trvm_derivation":false}