{"args":["adjudication:gpt:exec-v3:closures"],"basis":"derived","depth":1,"derivations":[{"bindings":{"X":"adjudication:gpt:exec-v3:closures"},"conclusion":["current","adjudication:gpt:exec-v3:closures"],"depth":1,"id":"sha256:c3282eabb26d331f0ea42309a510a63a310d8b6d2a4bbad2d1f91f86743fd7dd","premises":[["node","adjudication:gpt:exec-v3:closures","ADJUDICATION"],{"absent":["superseded","adjudication:gpt:exec-v3:closures"]},{"absent":["retracted","adjudication:gpt:exec-v3:closures"]}],"rule":"g0rule-0291a1396b8bb45cd9b48f187fa74c97312423799a65cc14a615974db7906f04#current"}],"evaluator":"graphonomous.g0.eval.v0","inputs":["root-2424d836f0742f39ff4089d50cd07341deb9ad2c625347a64e2e815e77b84b3c"],"key":"sha256:7c20d50c4a092f3d5a45faf6f2e042a73efc7a76acb317e4569ee0fbdc68ba2f","rel":"current","snapshot":"snapshot:g0:historical-699fbc2","trvm_derivation":false}