{"args":["assumption:text:tasks%20i.i.d.%20from%20the%20declared%20family"],"basis":"derived","depth":1,"derivations":[{"bindings":{"X":"assumption:text:tasks%20i.i.d.%20from%20the%20declared%20family"},"conclusion":["current","assumption:text:tasks%20i.i.d.%20from%20the%20declared%20family"],"depth":1,"id":"sha256:1f36ab269758f940398e8941078c22600217da393a7e8210c6682ad2a0b57eb3","premises":[["node","assumption:text:tasks%20i.i.d.%20from%20the%20declared%20family","ASSUMPTION"],{"absent":["superseded","assumption:text:tasks%20i.i.d.%20from%20the%20declared%20family"]},{"absent":["retracted","assumption:text:tasks%20i.i.d.%20from%20the%20declared%20family"]}],"rule":"g0rule-279caadc7dec1b030ba3657bfa7845504b84da8d387786e670804320d433eef9#current"}],"evaluator":"graphonomous.g0.eval.v0","inputs":["root-48ac3e32dfc56cd1450e43b92c7a38d83d71a95113da8b243951dfa305fd2213"],"key":"sha256:f0f9ad0dc9876c09790647de23156e181577a85ac85dbbb262d8f401bb83d0ca","rel":"current","snapshot":"snapshot:g0:multi-ba4e625-d217ee2","trvm_derivation":false}