{"args":["witness:factory:scripts/make-invariant-review-bundle.sh"],"basis":"derived","depth":1,"derivations":[{"bindings":{"X":"witness:factory:scripts/make-invariant-review-bundle.sh"},"conclusion":["current","witness:factory:scripts/make-invariant-review-bundle.sh"],"depth":1,"id":"sha256:d01a63f092b0d2f86dc28436991c5e704b4832f17b1c2d755b40631d774d78f1","premises":[["node","witness:factory:scripts/make-invariant-review-bundle.sh","WITNESS"],{"absent":["superseded","witness:factory:scripts/make-invariant-review-bundle.sh"]},{"absent":["retracted","witness:factory:scripts/make-invariant-review-bundle.sh"]}],"rule":"g0rule-279caadc7dec1b030ba3657bfa7845504b84da8d387786e670804320d433eef9#current"}],"evaluator":"graphonomous.g0.eval.v0","inputs":["root-44659ae753a5396fbec7f064cd4349811d577c1d3957703fd8b65fac20c5236d"],"key":"sha256:209ec79d08187045f547c4747645cb3372b80e0d3c0aca2ff70abc5d75e3128d","rel":"current","snapshot":"snapshot:g0:multi-v1-ba4e625-d217ee2","trvm_derivation":false}