{"args":["claim:crosswalk:E-12","obligation:inv:S3"],"basis":"derived","depth":1,"derivations":[{"bindings":{"A":"claim:crosswalk:E-12","B":"obligation:inv:S3"},"conclusion":["derives_from_tc","claim:crosswalk:E-12","obligation:inv:S3"],"depth":1,"id":"sha256:7ccef8e97b9bbbc0d195cea956c4b32b673a6c0a543006ea2a6b4586ced86013","premises":[["rel","rel:g0:DERIVES_FROM:claim:crosswalk:E-12:obligation:inv:S3","DERIVES_FROM","claim:crosswalk:E-12","obligation:inv:S3"]],"rule":"g0rule-279caadc7dec1b030ba3657bfa7845504b84da8d387786e670804320d433eef9#derives_from_direct"}],"evaluator":"graphonomous.g0.eval.v0","inputs":["root-44659ae753a5396fbec7f064cd4349811d577c1d3957703fd8b65fac20c5236d"],"key":"sha256:eecbb43586d97895204cae5c389a8a5ab27ac28f44871261c4385757675380c6","rel":"derives_from_tc","snapshot":"snapshot:g0:multi-v1-ba4e625-d217ee2","trvm_derivation":false}