{"args":["witness:r10:px13/all-negative-controls.txt#nc2_%2A%2Cnc4_%2A%2Cnc8_%2A"],"basis":"derived","depth":1,"derivations":[{"bindings":{"X":"witness:r10:px13/all-negative-controls.txt#nc2_%2A%2Cnc4_%2A%2Cnc8_%2A"},"conclusion":["current","witness:r10:px13/all-negative-controls.txt#nc2_%2A%2Cnc4_%2A%2Cnc8_%2A"],"depth":1,"id":"sha256:b846cd87b888b53ecd4723058cbf890ee81138cd57af64543d05dcef0156dc1e","premises":[["node","witness:r10:px13/all-negative-controls.txt#nc2_%2A%2Cnc4_%2A%2Cnc8_%2A","WITNESS"],{"absent":["superseded","witness:r10:px13/all-negative-controls.txt#nc2_%2A%2Cnc4_%2A%2Cnc8_%2A"]},{"absent":["retracted","witness:r10:px13/all-negative-controls.txt#nc2_%2A%2Cnc4_%2A%2Cnc8_%2A"]}],"rule":"g0rule-279caadc7dec1b030ba3657bfa7845504b84da8d387786e670804320d433eef9#current"}],"evaluator":"graphonomous.g0.eval.v0","inputs":["root-48ac3e32dfc56cd1450e43b92c7a38d83d71a95113da8b243951dfa305fd2213"],"key":"sha256:34cc1d38dfc817f0cb27b3cd735e42853b16f41db2cde3ef0772091e925e7ea9","rel":"current","snapshot":"snapshot:g0:multi-ba4e625-d217ee2","trvm_derivation":false}