{"args":["witness:factory:scripts/emb-battery-control.mjs#5","claim:factory:MOS-DERIVED-SUBJECT"],"basis":"derived","depth":1,"derivations":[{"bindings":{"A":"asrt:g0:rel:g0:WITNESSES:witness:factory:scripts/emb-battery-control.mjs#5:claim:factory:MOS-DERIVED-SUBJECT:loc:factory:23141cd132059483c6b1f4aaeb4c241231c43cf9:CLAIM_LEDGER.json#/claims/163/witnesses/0","C":"claim:factory:MOS-DERIVED-SUBJECT","R":"rel:g0:WITNESSES:witness:factory:scripts/emb-battery-control.mjs#5:claim:factory:MOS-DERIVED-SUBJECT","W":"witness:factory:scripts/emb-battery-control.mjs#5"},"conclusion":["supports","witness:factory:scripts/emb-battery-control.mjs#5","claim:factory:MOS-DERIVED-SUBJECT"],"depth":1,"id":"sha256:63a317aaa0f22bdbf19398a6a1eb353a39dfd800267ca1433c2fea9870345dcc","premises":[["rel","rel:g0:WITNESSES:witness:factory:scripts/emb-battery-control.mjs#5:claim:factory:MOS-DERIVED-SUBJECT","WITNESSES","witness:factory:scripts/emb-battery-control.mjs#5","claim:factory:MOS-DERIVED-SUBJECT"],["asrt","asrt:g0:rel:g0:WITNESSES:witness:factory:scripts/emb-battery-control.mjs#5:claim:factory:MOS-DERIVED-SUBJECT:loc:factory:23141cd132059483c6b1f4aaeb4c241231c43cf9:CLAIM_LEDGER.json#/claims/163/witnesses/0","rel:g0:WITNESSES:witness:factory:scripts/emb-battery-control.mjs#5:claim:factory:MOS-DERIVED-SUBJECT","loc:factory:23141cd132059483c6b1f4aaeb4c241231c43cf9:CLAIM_LEDGER.json#/claims/163/witnesses/0"],["aattr","asrt:g0:rel:g0:WITNESSES:witness:factory:scripts/emb-battery-control.mjs#5:claim:factory:MOS-DERIVED-SUBJECT:loc:factory:23141cd132059483c6b1f4aaeb4c241231c43cf9:CLAIM_LEDGER.json#/claims/163/witnesses/0","outcome","pass"]],"rule":"g0rule-279caadc7dec1b030ba3657bfa7845504b84da8d387786e670804320d433eef9#supports"}],"evaluator":"graphonomous.g0.eval.v0","inputs":["root-48ac3e32dfc56cd1450e43b92c7a38d83d71a95113da8b243951dfa305fd2213"],"key":"sha256:2b4c60ae966d3bde13d4cfa13712e6450be4be378472438a60b198925b46b981","rel":"supports","snapshot":"snapshot:g0:multi-ba4e625-d217ee2","trvm_derivation":false}