{"args":["artifact:factory:SRC-DEMILLO-1978-MUTATION"],"basis":"derived","depth":1,"derivations":[{"bindings":{"X":"artifact:factory:SRC-DEMILLO-1978-MUTATION"},"conclusion":["current","artifact:factory:SRC-DEMILLO-1978-MUTATION"],"depth":1,"id":"sha256:519b3a2eea42ba02f11d8a64fa91f24e96e3556058bb540d40a00e75d9e76a49","premises":[["node","artifact:factory:SRC-DEMILLO-1978-MUTATION","ARTIFACT"],{"absent":["superseded","artifact:factory:SRC-DEMILLO-1978-MUTATION"]},{"absent":["retracted","artifact:factory:SRC-DEMILLO-1978-MUTATION"]}],"rule":"g0rule-279caadc7dec1b030ba3657bfa7845504b84da8d387786e670804320d433eef9#current"}],"evaluator":"graphonomous.g0.eval.v0","inputs":["root-48ac3e32dfc56cd1450e43b92c7a38d83d71a95113da8b243951dfa305fd2213"],"key":"sha256:0da222cbc30614b5deeff60ed2a2560cbb2b362c78fcf64ec48b3074d7731395","rel":"current","snapshot":"snapshot:g0:multi-ba4e625-d217ee2","trvm_derivation":false}