{"args":["witness:r10:package-v2.6/witnesses/liveness_l1.py"],"basis":"derived","depth":1,"derivations":[{"bindings":{"X":"witness:r10:package-v2.6/witnesses/liveness_l1.py"},"conclusion":["current","witness:r10:package-v2.6/witnesses/liveness_l1.py"],"depth":1,"id":"sha256:5a0073d827657b3a681fb072ba96645d91b05bb10be164cffd6ab18f1d598880","premises":[["node","witness:r10:package-v2.6/witnesses/liveness_l1.py","WITNESS"],{"absent":["superseded","witness:r10:package-v2.6/witnesses/liveness_l1.py"]},{"absent":["retracted","witness:r10:package-v2.6/witnesses/liveness_l1.py"]}],"rule":"g0rule-279caadc7dec1b030ba3657bfa7845504b84da8d387786e670804320d433eef9#current"}],"evaluator":"graphonomous.g0.eval.v0","inputs":["root-c7f9c7595c3005b402f263bfe394d767a69adc8e338f7ed2640bfa015375bc87"],"key":"sha256:913e863dacb70f937f9c004dff89e23091e6f55194a6461e3a4027f6610a1259","rel":"current","snapshot":"snapshot:g0:historical-699fbc2","trvm_derivation":false}