{"args":["witness:r10:experiments/rust/results/S6_locus_birth.md"],"basis":"derived","depth":1,"derivations":[{"bindings":{"X":"witness:r10:experiments/rust/results/S6_locus_birth.md"},"conclusion":["current","witness:r10:experiments/rust/results/S6_locus_birth.md"],"depth":1,"id":"sha256:97fd218a488081781c27bdcacfb3000964ecb350f58418a00dcc9429ed1fba4b","premises":[["node","witness:r10:experiments/rust/results/S6_locus_birth.md","WITNESS"],{"absent":["superseded","witness:r10:experiments/rust/results/S6_locus_birth.md"]},{"absent":["retracted","witness:r10:experiments/rust/results/S6_locus_birth.md"]}],"rule":"g0rule-0291a1396b8bb45cd9b48f187fa74c97312423799a65cc14a615974db7906f04#current"}],"evaluator":"graphonomous.g0.eval.v0","inputs":["root-2424d836f0742f39ff4089d50cd07341deb9ad2c625347a64e2e815e77b84b3c"],"key":"sha256:661704d654a70ea5dc1d0f44c46437bfa85af1617268b3a2bbf64f0286a2a5e6","rel":"current","snapshot":"snapshot:g0:historical-699fbc2","trvm_derivation":false}