{"args":["witness:computedriven:receipts/R0.7.md"],"basis":"derived","depth":1,"derivations":[{"bindings":{"X":"witness:computedriven:receipts/R0.7.md"},"conclusion":["current","witness:computedriven:receipts/R0.7.md"],"depth":1,"id":"sha256:3069301e61fdd75d7c62fd149f94dfa793df5741014b6c6d5118065069d33765","premises":[["node","witness:computedriven:receipts/R0.7.md","WITNESS"],{"absent":["superseded","witness:computedriven:receipts/R0.7.md"]},{"absent":["retracted","witness:computedriven:receipts/R0.7.md"]}],"rule":"g0rule-0291a1396b8bb45cd9b48f187fa74c97312423799a65cc14a615974db7906f04#current"}],"evaluator":"graphonomous.g0.eval.v0","inputs":["root-2424d836f0742f39ff4089d50cd07341deb9ad2c625347a64e2e815e77b84b3c"],"key":"sha256:1a1f48ce8e10f41e4022cfb11b4a19d27ea6ac732b8d7e905a07017a0549669f","rel":"current","snapshot":"snapshot:g0:historical-699fbc2","trvm_derivation":false}