{"args":["claim:factory:LED-MUTATION-SURFACE"],"basis":"derived","depth":1,"derivations":[{"bindings":{"X":"claim:factory:LED-MUTATION-SURFACE"},"conclusion":["current","claim:factory:LED-MUTATION-SURFACE"],"depth":1,"id":"sha256:32b8be81581d3ec686db6daeefd25eadb8a2ba3016d3afa73c7f96682a4b9b62","premises":[["node","claim:factory:LED-MUTATION-SURFACE","CLAIM"],{"absent":["superseded","claim:factory:LED-MUTATION-SURFACE"]},{"absent":["retracted","claim:factory:LED-MUTATION-SURFACE"]}],"rule":"g0rule-279caadc7dec1b030ba3657bfa7845504b84da8d387786e670804320d433eef9#current"}],"evaluator":"graphonomous.g0.eval.v0","inputs":["root-ad27b735d86b51278fb6a0f5f61d117ff7f274e8b5716d49e1f43a40c7e03122"],"key":"sha256:46dcbf0f2e1c1f4f31f49d2ba0b3a25dab12a82ea3fe4c16f8b36a6011fac3f9","rel":"current","snapshot":"snapshot:g0:tri-ba4e625-d217ee2-8816e59","trvm_derivation":false}