{"args":["claim:factory:MOS-APPLIESUNDER-SINGLELEG"],"basis":"derived","depth":1,"derivations":[{"bindings":{"X":"claim:factory:MOS-APPLIESUNDER-SINGLELEG"},"conclusion":["current","claim:factory:MOS-APPLIESUNDER-SINGLELEG"],"depth":1,"id":"sha256:8686ba398feb8d67d51878f1ee8464f26da783a3b65cc11347fa94f16728aa91","premises":[["node","claim:factory:MOS-APPLIESUNDER-SINGLELEG","CLAIM"],{"absent":["superseded","claim:factory:MOS-APPLIESUNDER-SINGLELEG"]},{"absent":["retracted","claim:factory:MOS-APPLIESUNDER-SINGLELEG"]}],"rule":"g0rule-279caadc7dec1b030ba3657bfa7845504b84da8d387786e670804320d433eef9#current"}],"evaluator":"graphonomous.g0.eval.v0","inputs":["root-48ac3e32dfc56cd1450e43b92c7a38d83d71a95113da8b243951dfa305fd2213"],"key":"sha256:1b3d0cdff9409c64ca4cf4f7bbf5c3374c4bd1ed5f609194424a61d90f931024","rel":"current","snapshot":"snapshot:g0:multi-ba4e625-d217ee2","trvm_derivation":false}