{"args":["claim:crosswalk:E-11"],"basis":"derived","depth":2,"derivations":[{"bindings":{"C":"claim:crosswalk:E-11"},"conclusion":["exec_receipt_undecidable_from_source","claim:crosswalk:E-11"],"depth":2,"id":"sha256:1524db6aafa5682fe7c782c10f0aa0fac8e1975f4f3f85b8eac7e09ec5437268","premises":[["tested_claim","claim:crosswalk:E-11"],["attr","claim:crosswalk:E-11","receipts_typed",false],{"absent":["has_exec_receipt","claim:crosswalk:E-11"]}],"rule":"g0rule-279caadc7dec1b030ba3657bfa7845504b84da8d387786e670804320d433eef9#exec_receipt_undecidable_from_source"}],"evaluator":"graphonomous.g0.eval.v0","inputs":["root-44659ae753a5396fbec7f064cd4349811d577c1d3957703fd8b65fac20c5236d"],"key":"sha256:c756ccfcf48c3a947236229c7d0d9eb865f4aa40dc6d2942fda5ebc707d7fe53","rel":"exec_receipt_undecidable_from_source","snapshot":"snapshot:g0:multi-v1-ba4e625-d217ee2","trvm_derivation":false}