{"args":["claim:factory:EMB-AUTH-NONAMP"],"basis":"derived","depth":1,"derivations":[{"bindings":{"X":"claim:factory:EMB-AUTH-NONAMP"},"conclusion":["current","claim:factory:EMB-AUTH-NONAMP"],"depth":1,"id":"sha256:aea6c223aad04c5ad32a678a7e6facf48aed6b22bcb3c7df346ab3ada65592ba","premises":[["node","claim:factory:EMB-AUTH-NONAMP","CLAIM"],{"absent":["superseded","claim:factory:EMB-AUTH-NONAMP"]},{"absent":["retracted","claim:factory:EMB-AUTH-NONAMP"]}],"rule":"g0rule-0291a1396b8bb45cd9b48f187fa74c97312423799a65cc14a615974db7906f04#current"}],"evaluator":"graphonomous.g0.eval.v0","inputs":["root-2424d836f0742f39ff4089d50cd07341deb9ad2c625347a64e2e815e77b84b3c"],"key":"sha256:8671540c8878cd2eadc7f79f3f20c8582b548079ceeda770524fedb40421711c","rel":"current","snapshot":"snapshot:g0:historical-699fbc2","trvm_derivation":false}