{"args":["claim:factory:FED-1PA-MISS"],"basis":"derived","depth":1,"derivations":[{"bindings":{"X":"claim:factory:FED-1PA-MISS"},"conclusion":["current","claim:factory:FED-1PA-MISS"],"depth":1,"id":"sha256:88bf905ddd3fd668f695156a008592524e5078886e3351315dff86c05e6e091e","premises":[["node","claim:factory:FED-1PA-MISS","CLAIM"],{"absent":["superseded","claim:factory:FED-1PA-MISS"]},{"absent":["retracted","claim:factory:FED-1PA-MISS"]}],"rule":"g0rule-279caadc7dec1b030ba3657bfa7845504b84da8d387786e670804320d433eef9#current"}],"evaluator":"graphonomous.g0.eval.v0","inputs":["root-ad27b735d86b51278fb6a0f5f61d117ff7f274e8b5716d49e1f43a40c7e03122"],"key":"sha256:9a48bf046663e4ba8a812b1d9055849b41fb12d069a5f5950271afb100b1c77a","rel":"current","snapshot":"snapshot:g0:tri-ba4e625-d217ee2-8816e59","trvm_derivation":false}