{"args":["law:wek:W-6"],"basis":"derived","depth":1,"derivations":[{"bindings":{"X":"law:wek:W-6"},"conclusion":["current","law:wek:W-6"],"depth":1,"id":"sha256:1529878d2e657a727ea7c0dd31ce3c4f0b2be7843c4bc4fa2d533c8b1bc7c7b0","premises":[["node","law:wek:W-6","LAW"],{"absent":["superseded","law:wek:W-6"]},{"absent":["retracted","law:wek:W-6"]}],"rule":"g0rule-0291a1396b8bb45cd9b48f187fa74c97312423799a65cc14a615974db7906f04#current"}],"evaluator":"graphonomous.g0.eval.v0","inputs":["root-0eea954b5fb07e8a29e88f808c0902abe8fce90b9b04b68864297986769579e3"],"key":"sha256:7117adcdec64c45e1c9360e1a95ce70b3f1df28987319e00ae210a29ca53c952","rel":"current","snapshot":"snapshot:g0:baseline-ba4e625","trvm_derivation":false}