{"args":["receipt:factory:mosaic/receipts/INV-R7.4.json"],"basis":"derived","depth":1,"derivations":[{"bindings":{"X":"receipt:factory:mosaic/receipts/INV-R7.4.json"},"conclusion":["current","receipt:factory:mosaic/receipts/INV-R7.4.json"],"depth":1,"id":"sha256:bfe92c3502f898c5c7a08fba1ab4adbfff90d77fb4dc49aabce5ca1a34b22843","premises":[["node","receipt:factory:mosaic/receipts/INV-R7.4.json","RECEIPT"],{"absent":["superseded","receipt:factory:mosaic/receipts/INV-R7.4.json"]},{"absent":["retracted","receipt:factory:mosaic/receipts/INV-R7.4.json"]}],"rule":"g0rule-279caadc7dec1b030ba3657bfa7845504b84da8d387786e670804320d433eef9#current"}],"evaluator":"graphonomous.g0.eval.v0","inputs":["root-48ac3e32dfc56cd1450e43b92c7a38d83d71a95113da8b243951dfa305fd2213"],"key":"sha256:914bab9b40df5feb0006999a1355bc5fd1357e5af94faef97b79b0e803ad82bc","rel":"current","snapshot":"snapshot:g0:multi-ba4e625-d217ee2","trvm_derivation":false}