{"args":["claim:crosswalk:E-14"],"basis":"derived","depth":1,"derivations":[{"bindings":{"A":"asrt:g0:rel:g0:WITNESSES:receipt:sha256:525211840abb0b9d381f42537acc896a85e7fceeb49a5238ef90c075bdebf658:claim:crosswalk:E-14:loc:crosswalk:c7dba29f2035b84386ac66037693f2ef7c4e05f6:package-v2.7/CROSS_REGISTRY_CLAIM_MAP.json#/promotions/1/pre_fix_witness","R":"rel:g0:WITNESSES:receipt:sha256:525211840abb0b9d381f42537acc896a85e7fceeb49a5238ef90c075bdebf658:claim:crosswalk:E-14","Subject":"claim:crosswalk:E-14","W":"receipt:sha256:525211840abb0b9d381f42537acc896a85e7fceeb49a5238ef90c075bdebf658"},"conclusion":["has_exec_receipt","claim:crosswalk:E-14"],"depth":1,"id":"sha256:ea668ac975981a2ddfb7e1587fb3a34166420a78fa3c9a3d09ddac573ab26c52","premises":[["rel","rel:g0:WITNESSES:receipt:sha256:525211840abb0b9d381f42537acc896a85e7fceeb49a5238ef90c075bdebf658:claim:crosswalk:E-14","WITNESSES","receipt:sha256:525211840abb0b9d381f42537acc896a85e7fceeb49a5238ef90c075bdebf658","claim:crosswalk:E-14"],["node","receipt:sha256:525211840abb0b9d381f42537acc896a85e7fceeb49a5238ef90c075bdebf658","RECEIPT"],["attr","receipt:sha256:525211840abb0b9d381f42537acc896a85e7fceeb49a5238ef90c075bdebf658","sha256_verified_at_pin",true],["asrt","asrt:g0:rel:g0:WITNESSES:receipt:sha256:525211840abb0b9d381f42537acc896a85e7fceeb49a5238ef90c075bdebf658:claim:crosswalk:E-14:loc:crosswalk:c7dba29f2035b84386ac66037693f2ef7c4e05f6:package-v2.7/CROSS_REGISTRY_CLAIM_MAP.json#/promotions/1/pre_fix_witness","rel:g0:WITNESSES:receipt:sha256:525211840abb0b9d381f42537acc896a85e7fceeb49a5238ef90c075bdebf658:claim:crosswalk:E-14","loc:crosswalk:c7dba29f2035b84386ac66037693f2ef7c4e05f6:package-v2.7/CROSS_REGISTRY_CLAIM_MAP.json#/promotions/1/pre_fix_witness"],["aattr","asrt:g0:rel:g0:WITNESSES:receipt:sha256:525211840abb0b9d381f42537acc896a85e7fceeb49a5238ef90c075bdebf658:claim:crosswalk:E-14:loc:crosswalk:c7dba29f2035b84386ac66037693f2ef7c4e05f6:package-v2.7/CROSS_REGISTRY_CLAIM_MAP.json#/promotions/1/pre_fix_witness","executed",true]],"rule":"g0rule-279caadc7dec1b030ba3657bfa7845504b84da8d387786e670804320d433eef9#has_exec_receipt"},{"bindings":{"A":"asrt:g0:rel:g0:WITNESSES:receipt:sha256:6ba8544cbf7c91ef526ddde97943d54845e1f352814173b8fa9a64f86867a913:claim:crosswalk:E-14:loc:crosswalk:c7dba29f2035b84386ac66037693f2ef7c4e05f6:package-v2.7/CROSS_REGISTRY_CLAIM_MAP.json#/promotions/1/repair_witness","R":"rel:g0:WITNESSES:receipt:sha256:6ba8544cbf7c91ef526ddde97943d54845e1f352814173b8fa9a64f86867a913:claim:crosswalk:E-14","Subject":"claim:crosswalk:E-14","W":"receipt:sha256:6ba8544cbf7c91ef526ddde97943d54845e1f352814173b8fa9a64f86867a913"},"conclusion":["has_exec_receipt","claim:crosswalk:E-14"],"depth":1,"id":"sha256:de90a6535b097ce1831d4f9d55e74fd665a2494a08ebc2fb692c9d9e8e9d6183","premises":[["rel","rel:g0:WITNESSES:receipt:sha256:6ba8544cbf7c91ef526ddde97943d54845e1f352814173b8fa9a64f86867a913:claim:crosswalk:E-14","WITNESSES","receipt:sha256:6ba8544cbf7c91ef526ddde97943d54845e1f352814173b8fa9a64f86867a913","claim:crosswalk:E-14"],["node","receipt:sha256:6ba8544cbf7c91ef526ddde97943d54845e1f352814173b8fa9a64f86867a913","RECEIPT"],["attr","receipt:sha256:6ba8544cbf7c91ef526ddde97943d54845e1f352814173b8fa9a64f86867a913","sha256_verified_at_pin",true],["asrt","asrt:g0:rel:g0:WITNESSES:receipt:sha256:6ba8544cbf7c91ef526ddde97943d54845e1f352814173b8fa9a64f86867a913:claim:crosswalk:E-14:loc:crosswalk:c7dba29f2035b84386ac66037693f2ef7c4e05f6:package-v2.7/CROSS_REGISTRY_CLAIM_MAP.json#/promotions/1/repair_witness","rel:g0:WITNESSES:receipt:sha256:6ba8544cbf7c91ef526ddde97943d54845e1f352814173b8fa9a64f86867a913:claim:crosswalk:E-14","loc:crosswalk:c7dba29f2035b84386ac66037693f2ef7c4e05f6:package-v2.7/CROSS_REGISTRY_CLAIM_MAP.json#/promotions/1/repair_witness"],["aattr","asrt:g0:rel:g0:WITNESSES:receipt:sha256:6ba8544cbf7c91ef526ddde97943d54845e1f352814173b8fa9a64f86867a913:claim:crosswalk:E-14:loc:crosswalk:c7dba29f2035b84386ac66037693f2ef7c4e05f6:package-v2.7/CROSS_REGISTRY_CLAIM_MAP.json#/promotions/1/repair_witness","executed",true]],"rule":"g0rule-279caadc7dec1b030ba3657bfa7845504b84da8d387786e670804320d433eef9#has_exec_receipt"},{"bindings":{"A":"asrt:g0:rel:g0:WITNESSES:receipt:sha256:6ba8544cbf7c91ef526ddde97943d54845e1f352814173b8fa9a64f86867a913:claim:crosswalk:E-14:loc:crosswalk:c7dba29f2035b84386ac66037693f2ef7c4e05f6:package-v2.7/CROSS_REGISTRY_CLAIM_MAP.json#/promotions/1/sensitivity_witness","R":"rel:g0:WITNESSES:receipt:sha256:6ba8544cbf7c91ef526ddde97943d54845e1f352814173b8fa9a64f86867a913:claim:crosswalk:E-14","Subject":"claim:crosswalk:E-14","W":"receipt:sha256:6ba8544cbf7c91ef526ddde97943d54845e1f352814173b8fa9a64f86867a913"},"conclusion":["has_exec_receipt","claim:crosswalk:E-14"],"depth":1,"id":"sha256:4df140ba818001081f7639bcdfb4ca1605cb84f5981d564f9598bf01259bcc93","premises":[["rel","rel:g0:WITNESSES:receipt:sha256:6ba8544cbf7c91ef526ddde97943d54845e1f352814173b8fa9a64f86867a913:claim:crosswalk:E-14","WITNESSES","receipt:sha256:6ba8544cbf7c91ef526ddde97943d54845e1f352814173b8fa9a64f86867a913","claim:crosswalk:E-14"],["node","receipt:sha256:6ba8544cbf7c91ef526ddde97943d54845e1f352814173b8fa9a64f86867a913","RECEIPT"],["attr","receipt:sha256:6ba8544cbf7c91ef526ddde97943d54845e1f352814173b8fa9a64f86867a913","sha256_verified_at_pin",true],["asrt","asrt:g0:rel:g0:WITNESSES:receipt:sha256:6ba8544cbf7c91ef526ddde97943d54845e1f352814173b8fa9a64f86867a913:claim:crosswalk:E-14:loc:crosswalk:c7dba29f2035b84386ac66037693f2ef7c4e05f6:package-v2.7/CROSS_REGISTRY_CLAIM_MAP.json#/promotions/1/sensitivity_witness","rel:g0:WITNESSES:receipt:sha256:6ba8544cbf7c91ef526ddde97943d54845e1f352814173b8fa9a64f86867a913:claim:crosswalk:E-14","loc:crosswalk:c7dba29f2035b84386ac66037693f2ef7c4e05f6:package-v2.7/CROSS_REGISTRY_CLAIM_MAP.json#/promotions/1/sensitivity_witness"],["aattr","asrt:g0:rel:g0:WITNESSES:receipt:sha256:6ba8544cbf7c91ef526ddde97943d54845e1f352814173b8fa9a64f86867a913:claim:crosswalk:E-14:loc:crosswalk:c7dba29f2035b84386ac66037693f2ef7c4e05f6:package-v2.7/CROSS_REGISTRY_CLAIM_MAP.json#/promotions/1/sensitivity_witness","executed",true]],"rule":"g0rule-279caadc7dec1b030ba3657bfa7845504b84da8d387786e670804320d433eef9#has_exec_receipt"}],"evaluator":"graphonomous.g0.eval.v0","inputs":["root-ad27b735d86b51278fb6a0f5f61d117ff7f274e8b5716d49e1f43a40c7e03122"],"key":"sha256:186eea46d87f2946c63bc8122e1048b0064836adfff68027aef12f900087c694","rel":"has_exec_receipt","snapshot":"snapshot:g0:tri-ba4e625-d217ee2-8816e59","trvm_derivation":false}