{"args":["adjudication:gpt:exec-v3:s8"],"basis":"derived","depth":1,"derivations":[{"bindings":{"X":"adjudication:gpt:exec-v3:s8"},"conclusion":["current","adjudication:gpt:exec-v3:s8"],"depth":1,"id":"sha256:601287eaf6277fe7162dc2acf301f240429e25dd07b107a664c6d07b6dcf2ad5","premises":[["node","adjudication:gpt:exec-v3:s8","ADJUDICATION"],{"absent":["superseded","adjudication:gpt:exec-v3:s8"]},{"absent":["retracted","adjudication:gpt:exec-v3:s8"]}],"rule":"g0rule-279caadc7dec1b030ba3657bfa7845504b84da8d387786e670804320d433eef9#current"}],"evaluator":"graphonomous.g0.eval.v0","inputs":["root-c7f9c7595c3005b402f263bfe394d767a69adc8e338f7ed2640bfa015375bc87"],"key":"sha256:ed2c9b5369059f120b6e1659fb583c5000815ac110a9ea371e7c29f74d06023d","rel":"current","snapshot":"snapshot:g0:historical-699fbc2","trvm_derivation":false}