{"args":["profile:text:h.eb322fa16d85b802"],"basis":"derived","depth":1,"derivations":[{"bindings":{"X":"profile:text:h.eb322fa16d85b802"},"conclusion":["current","profile:text:h.eb322fa16d85b802"],"depth":1,"id":"sha256:44a95842699fd42c96ce260e7b3713cfd38863795b3d139c5a1d43f3a3cf020d","premises":[["node","profile:text:h.eb322fa16d85b802","PROFILE"],{"absent":["superseded","profile:text:h.eb322fa16d85b802"]},{"absent":["retracted","profile:text:h.eb322fa16d85b802"]}],"rule":"g0rule-0291a1396b8bb45cd9b48f187fa74c97312423799a65cc14a615974db7906f04#current"}],"evaluator":"graphonomous.g0.eval.v0","inputs":["root-2424d836f0742f39ff4089d50cd07341deb9ad2c625347a64e2e815e77b84b3c"],"key":"sha256:cf237db3bfac331f6215e566d751094066d58bfa5aacc4979065c1ef423f009a","rel":"current","snapshot":"snapshot:g0:historical-699fbc2","trvm_derivation":false}