{"args":["claim:crosswalk:E-47"],"basis":"derived","depth":1,"derivations":[{"bindings":{"X":"claim:crosswalk:E-47"},"conclusion":["current","claim:crosswalk:E-47"],"depth":1,"id":"sha256:76d05ce2ab4768ebb489afad4eef3d4f69f5ddebfc36a84de01112eb9344c213","premises":[["node","claim:crosswalk:E-47","CLAIM"],{"absent":["superseded","claim:crosswalk:E-47"]},{"absent":["retracted","claim:crosswalk:E-47"]}],"rule":"g0rule-279caadc7dec1b030ba3657bfa7845504b84da8d387786e670804320d433eef9#current"}],"evaluator":"graphonomous.g0.eval.v0","inputs":["root-44659ae753a5396fbec7f064cd4349811d577c1d3957703fd8b65fac20c5236d"],"key":"sha256:59c0bf855ed44276293fe4b2e5635f26fd5f2dcac4a38c91f70f34a53a470709","rel":"current","snapshot":"snapshot:g0:multi-v1-ba4e625-d217ee2","trvm_derivation":false}