{"args":["law:crosswalk:CROSS"],"basis":"derived","depth":1,"derivations":[{"bindings":{"X":"law:crosswalk:CROSS"},"conclusion":["current","law:crosswalk:CROSS"],"depth":1,"id":"sha256:99ee67e84d4fab6a95cdb6fa44497865abd2134a55d68711b79c0571479e9e8e","premises":[["node","law:crosswalk:CROSS","LAW"],{"absent":["superseded","law:crosswalk:CROSS"]},{"absent":["retracted","law:crosswalk:CROSS"]}],"rule":"g0rule-0291a1396b8bb45cd9b48f187fa74c97312423799a65cc14a615974db7906f04#current"}],"evaluator":"graphonomous.g0.eval.v0","inputs":["root-2424d836f0742f39ff4089d50cd07341deb9ad2c625347a64e2e815e77b84b3c"],"key":"sha256:cc0b455fa34bdc42fec0c8a35796eeef307dfc0062d2e3b1f404089841e739d6","rel":"current","snapshot":"snapshot:g0:historical-699fbc2","trvm_derivation":false}