{"args":["receipt:trvm-gov:brun-6805c3e578aa48fee8e1a3325d14ec72e03eff7defcbe092270807217abd47e7.PINNED"],"basis":"derived","depth":1,"derivations":[{"bindings":{"X":"receipt:trvm-gov:brun-6805c3e578aa48fee8e1a3325d14ec72e03eff7defcbe092270807217abd47e7.PINNED"},"conclusion":["current","receipt:trvm-gov:brun-6805c3e578aa48fee8e1a3325d14ec72e03eff7defcbe092270807217abd47e7.PINNED"],"depth":1,"id":"sha256:17c10823c8f59815ed3f77a5b192676f1c4440ee6b1052455d9ee0d3677c140c","premises":[["node","receipt:trvm-gov:brun-6805c3e578aa48fee8e1a3325d14ec72e03eff7defcbe092270807217abd47e7.PINNED","RECEIPT"],{"absent":["superseded","receipt:trvm-gov:brun-6805c3e578aa48fee8e1a3325d14ec72e03eff7defcbe092270807217abd47e7.PINNED"]},{"absent":["retracted","receipt:trvm-gov:brun-6805c3e578aa48fee8e1a3325d14ec72e03eff7defcbe092270807217abd47e7.PINNED"]}],"rule":"g0rule-279caadc7dec1b030ba3657bfa7845504b84da8d387786e670804320d433eef9#current"}],"evaluator":"graphonomous.g0.eval.v0","inputs":["root-ad27b735d86b51278fb6a0f5f61d117ff7f274e8b5716d49e1f43a40c7e03122"],"key":"sha256:f57ab84679a496eb71d6554c01329c4d2033cfc91b46fa11d954e5b8d20089c9","rel":"current","snapshot":"snapshot:g0:tri-ba4e625-d217ee2-8816e59","trvm_derivation":false}